Andrew Willson,Seldon,Head of Customer Success,Production ML Serving & Monitoring in Kubernetes,"This talk offers a practical guide to building a state-of-the-art MLOps deployment platform using Kubernetes, with a focus on deploying deep learning models. Attendees will gain insights into the integration of key technologies including NVIDIA Triton Inference Server, Seldon Core v2, Kafka, Prometheus, and Grafana. The session covers an end-to-end workflow for serving complex models like transformers and CNNs and configuring monitoring on top. The knowledge shared will be valuable for those looking to enhance model performance, reduce costs, and unlock new use cases in machine learning.","By attending this talk, the audience will learn how to set up a state-of-the art MLOps deployment platform on top of Kubernetes.  Once it is up and running, they will learn how to serve deep learning models in a robust and scalable way.  As inference is being performed, the audience will see how they can configure rich monitoring to observe their models in production.

Along the way, the audience will learn about each of the technologies being presented, including: Kubernetes, PyTorch, NVIDIA Triton Inference Server, Seldon Core v2, Kafka, Prometheus, and Grafana.  More importantly, they will see how these tools integrate with one another to form a fully fledged MLOps deployment platform.

MLOps deployment platforms are very challenging systems to build, deploy, and operate in the real-world.  As more and more business value is being driven by large, complex, deep learning (e.g. transformer, diffusion, CNN) models, it is crucial to be able to serve these in a scalable way.  This type of a platform creates business value by: (1) reducing inference costs through efficient serving, (2) improving performance through continuous monitoring and deployment, (3) enhancing the user experience with low latency, (4) shortening the time to bring use cases to market, and (5) eliminating the up-front development costs of building a deployment platform.

Aside from benefitting the business, engineers can benefit knowing that they are using best-in-breed tools, that they have a consistent way of deploying ML models, and that they have monitoring and logging built in.  Enabling engineers to build complex, data-centric pipelines opens up a new set of use cases, including advanced recommendation engines, explainable machine vision models, and even LLM question-and-answer applications.
",,Workshop,5.0,Deployment and integration,"Kubernetes, Deep Learning Models, MLOps Deployment
","Andrew is the Head of Customer Success at Seldon, enabling enterprise customers to get the most out of the Seldon ecosystem of tools. Andrew has spent the last 10 years in technical, client-facing roles with a focus on data, machine learning, and architecture. He loves transforming complex and ambiguous topics into clear actions that drive value within an organization. Outside of work, you might find Andrew riding his bike around the streets of London or snowboarding somewhere in The Alps.",https://www.youtube.com/watch?v=m1KI3rFqlPI,,It's an interesting personal problem I wanted to tackle and shows how to overcome lots of technical challenges the audience can relate to.,,m1KI3rFqlPI
Chinar Movsisyan,Feedback Intelligence,CEO,"Optimizing LLM apps through usage: Implicit feedback, given explicitly","In the rapidly evolving landscape of LLM-powered applications, AI teams face a unique challenge: gathering actionable insights from real-world usage to continuously improve app performance. This presentation will explore the common obstacles teams encounter when attempting to optimize their applications based on user interactions. We will dive into how implicit feedback—often hidden within everyday user behavior—can be harnessed effectively to drive measurable improvements. By sharing our approach to extracting and leveraging this data, we'll demonstrate how it accelerates the development of smarter, more responsive LLM applications.",,,Furture of AI,,Performance optimization and efficiency,"Implicit feedback, LLM optimization, User behavior insights","Chinar Movsisyan is the founder and CEO of Feedback Intelligence, an MLOps company based in San Francisco that enables enterprises to make sure that LLM-based products are reliable and that the output is aligned with end-user expectations. With over eight years of experience in deep learning, spanning from research labs to venture-backed startups, Chinar has led AI projects in mission-critical applications such as healthcare, drones, and satellites. ",https://www.youtube.com/watch?v=M7B02XA_COQ,,,MLOps & GenAI World 2024,M7B02XA_COQ
Yoshua Bengio,Mila / U. Montreal,Scientific Director / Full Professor,Large Neural Nets for Amortized Probabilistic Inference for Highly Multimodal Distributions and Model-Based ML,"Current large language models and other large-scale neural nets directly fit data, thus learning to imitate its distribution. Is it possible to do better? Consider the possibility, which we claim is actually the typical case, where a world model that captures causal structure in the world would require substantially fewer bits than the code that performs the kinds of inferences that we may desire from that knowledge. For example, the rules of the game of Go or the rules of logical reasoning are fairly compact, whereas inference (e.g., playing Go at Champion level, or being able to discover or prove theorems) may require a lot more computation (i.e., huge neural nets). In fact, exact inference for many problems (in science, computing, or in coming up with Bayesian posteriors) is often intractable and so we resort to approximate solutions. With amortized probabilistic inference, we expend computation upfront to train a neural net that learns to answer questions (for example sample latent variables or parameters) in a way that is as consistent as possible with the world model, making run-time inference quick. This also makes it possible to exploit the generalization ability of the approximate inference generative learner to guess where good answers (e.g., modes of a highly multimodal posterior distribution) might be. It also allows to decouple the capacity needed for inference from the capacity needed to describe the world model. This is unlike current state-of-the-art in deep learning, where inference and world model are confounded,  yielding overfitting of the world knowledge and underfitting of the inference machine. We have recently introduced a novel framework for achieving this kind of model-based ML, with generative flow networks (or GFlowNets), which have relations to reinforcement learning, variational inference and generative models. We'll highlight some of the advances achieved with GFlowNets and close with our research programme to exploit such probabilistic inference machinery to incorporate in ML inductive biases inspired by high-level human cognition and build AI systems that focus on understanding the world in a Bayesian and causal way and generating probabilistically truthful statements.",,,,7.0,"Model dev, training, arch.","Amortized Probabilistic Inference, GFlowNets, Model-Based Machine Learning





","Recognized worldwide as one of the leading experts in artificial intelligence, Yoshua Bengio is most known for his pioneering work in deep learning, earning him the 2018 A.M. Turing Award, “the Nobel Prize of Computing,” with Geoffrey Hinton and Yann LeCun.

He is a Full Professor at Université de Montréal, and the Founder and Scientific Director of Mila – Quebec AI Institute. He co-directs the CIFAR Learning in Machines & Brains program as Senior Fellow and acts as Scientific Director of IVADO.

In 2019, he was awarded the prestigious Killam Prize and in 2022, became the computer scientist with the highest h-index in the world. He is a Fellow of both the Royal Society of London and Canada, Knight of the Legion of Honor of France and Officer of the Order of Canada.

Concerned about the social impact of AI and the objective that AI benefits all, he actively contributed to the Montreal Declaration for the Responsible Development of Artificial Intelligence.",https://www.youtube.com/watch?v=OiMZI-xMjbU,AI Research,,,OiMZI-xMjbU
Zahra  Kharal,Venterra Realty,"ML Engineer, Data Scientist (Principal)",Leveraging ML in Multi-Family Real Estate Industry: From Predicting Rentals to Streamlining Operations ,"The multifamily real estate industry has witnessed an increased adoption of machine learning (ML) in recent years; allowing it to recover from its initial relatively slow adoption of ML technology and catch up to other industries in the field. The use of ML started to move into the multifamily real estate industry, offering new and innovative ways to analyze and operate properties, providing greater efficiency and optimization to investors, owners, and property managers. This presentation will showcase a collection of innovative ML case studies and application projects in multi-family real estate at Venterra Realty. 

One case study at Venterra where ML has shown its value was in predicting renter trends and tenure tendencies.  At Venterra, we started 20 years ago, capturing and structuring data, that we thought would eventually be useful for this purpose. By utilizing the 20 years of data that Venterra had, including 70+ features, Venterra built ML algorithms and pipelines that can more accurately help in identifying tenant behavior patterns, such as rent-paying habits and the likelihood of renewing a lease. This accumulative data was then used to make occupancy forecasts months in advance. The results of these models were used to understand tenant behavior better, improve retention rates and help planning and budgeting. An interesting question arose from this model: If we give the model results to the property managers, how will it influence their behavior in regard to tenant dealings.

Another interesting application of ML at Venterra was identifying maintenance needs and developing models for preventative maintenance. By analyzing data from millions of maintenance requests and several other sources, over many years, Venterra used NLP and classification techniques to predict request categories and thus assign these requests to the correct department in almost real time. Additionally, using deep-learning time-series models Venterra was able to predict when repairs will be necessary and schedule them proactively, while also predicting the budget required for these repairs. 

Through these case studies and application projects, attendees will gain an understanding of how ML is influencing operations at Venterra. They will see to succeed in ML endeavours, data strategies and proper data collection methodologies needs to be made decades in advance, and learn how pipelines need to be developed to successfully put the models in production. The benefits that Venterra has received since then will also be briefly discussed. Ultimately, this presentation will inspire traditionally non-tech industries to explore the potential of AI and ML in their own operations, and will prepare them for what’s needed in order to succeed. 

A bit about Venterra: Venterra specializes in the identification, development, finance, acquisition, and management of multi-family residential communities in the United States. We manage a portfolio of multi-family real estate assets totaling over $4.7 billion in value and have completed more than $8.7 billion of real estate transactions. Venterra has differentiated itself from its competitors by deploying industry leading technology to the benefit of both residents and investors. This technology includes a comprehensive suite of entirely web-enabled applications covering rent management, pricing optimization, purchase order management, utility billing, work order and capital expenditure management; an entire suite of back-end financial applications and customized workflows; and reporting and more recently the adoption of ML. 
","Through the case studies and application projects at Venterra Realty, attendees will gain an understanding of how ML is transforming the operations at Venterra and the multi-family real estate industry at large. They will learn specifically what data problems are encountered in the real estate domain, how the models were developed and what pipelines needed to be developed to successfully put the models in production. Issues encountered, unique to this industry, will also be discussed.",,Case Study,3.0,"Model dev, training, arch.","Machine Learning, Multi-Family Real Estate, Case Study





","Selected as a women in engineering rising star, Zahra has worked on solving problems related to data and modeling across industries, from engineering, sustainability and climate change, for University of Toronto and NRC, to more recently real estate. In her time at Venterra Realty, she has been responsible for implementing the Data Science and AI/ML projects; in just a few years, the Venterra AI/ML team has successfully developed various models, pipelines and in-house AI apps to help solve several business needs. From her research, she has published 12 journal papers and more than 20 conference papers. She is a member of the American Concrete Institute (ACI), American Society for Civil Engineering (ASCE), Canadian Association of Earthquake Engineering (CAEE) and Canadian Society for Civil Engineering (CSCE).",https://www.youtube.com/watch?v=qr0-RHG4U18,,"Real Estate multi-family industry has been behind in adopting ML, as the industry is traditionally tech slow. Moreover, for the most part, real estate companies use third parties to buy the software or technology. Venterra is unique in the sense of developing technology, applications and ML models in-house. Thus, the audience will get a unique glimpse into this industries data issues, its problems and how ML is being used to solve them. Additionally, rarely does real estate industry participate in technology summits or conferences such as this, so this will be an interesting glimpse in the world of proptech.
This presentation aims to inspire not only those data scientists and product engineers, but also real estate dabblers, property managers, investors, and other traditionally non-tech industries to explore the potential of AI and ML in their own operations. ",TMLS 2023,qr0-RHG4U18
Ashley Varghese,Canadian National Railways (CN),Data Scientist,Automated Inspection for rail cars using computer vision and machine learning,"CN is one of the organizations which realized the importance of AI very early and adopted some of the latest technologies in railroad operations. We at CN have been evaluating and adopting some of the latest approaches to carry out automated inspections of railcars that improve overall operational efficiency. The automated inspection of the railcars is achieved by leveraging computer vision and machine learning techniques. For automated inspection of railcars, the train passes through the portals which have equipped with two generations of cameras and are positioned to capture all sides of the railcar including the undercarriage. Once these images are captured, they are sent to the inference engine to detect the defects. However, developing machine learning pipelines and training robust models comes with its own challenges. In this talk, I would be covering how computer vision and machine learning techniques are used for developing some of the use cases, and various challenges associated with developing these machine learning pipelines. One of the key challenges is selecting the right data for training which must be representative of the actual data from the portal. Self-supervised learning-based techniques are adopted to identify the unique samples from the pool of unlabeled datasets. Another challenge associated with the model performance is image quality. The quality of the image captured at the portals is affected by different weather and lighting conditions. In addition to these, there are several other challenges such as subjectivity in defect classification, lack of samples for the defective class and imbalanced datasets, etc. I will pick one of the use cases we developed and then go over discussing some challenges faced and how we tackled these challenges to improve the performance of the use cases. By choosing the right data and computer vision approaches, it is possible to develop effective solutions for the automated inspection of cars. ","This talk provides insight into how computer vision and machine learning are applied in the railroad domain for the inspection of rail cars. It includes the challenges, strategies, and practical considerations that are associated with developing an ML-based automated inspection pipeline for a real-world, safety-critical application.",,Case Study,4.0,Deployment and integration,"Computer Vision, Machine Learning, Automated Inspection





","Ashley is a data scientist at Canadian National Railway. She works in the automated inspection program overseeing the development and retraining aspects for the inspection of rail cars. She has over 12 years of research experience in computer vision and deep learning. Her research papers were published in multiple international conferences and journals. She has previously worked as an AI Scientist with Qii.AI and as a researcher with TCS Innovation Lab. She holds an MTech in Computer Science from the International Institute of Information Technology, Bangalore.",https://www.youtube.com/watch?v=EzQLEea-4wU,Railroad,"This talk is based on my first-hand experience in developing and deploying ML pipelines for a real-world inspection program. This provides insight into real-world data, the challenges associated with training a robust model, and evaluate the performance of the model in production, and improve the model performance with retraining.
",TMLS 2023,EzQLEea-4wU
Niv Hertz,Solutions Architect,Aporia,Monitoring LLMs: Where to Begin? What's Important?,"Dive into the world of monitoring Large Language Models (LLMs). We'll cover key points like tracking drift and measuring model performance, and highlight useful tools and alert systems. This talk aims to give data scientists and ML engineers a basic but solid starting point on their monitoring journey to ensure high performance of their LLMs, contributing to the development of next-gen models.",,,Ignite Lighting Talk,,"Model dev, training, arch.","LLMs, Monitoring, Performance
","Niv Hertz is a Solutions Architect at Aporia, where he customizes ML monitoring to support any use case or need. Before joining Aporia, Niv worked as a Software Engineer and Cyber Security expert at other startups and in the elite 81 intelligence unit of the Israel Defense Forces. When he is not in front of a computer, Niv also enjoys hiking and basketball.",https://www.youtube.com/watch?v=Qje3tWudbMQ,,,TMLS 2023,Qje3tWudbMQ
Aarushi Kansal,AutoGPT,AI Engineer,From Paper to Production in 30 Minutes: Implementing code-less Gen AI Research,"There are new research papers in the Gen AI space, about prompting, RAG, different models, different ways to finetune almost every other day these days. Often they come with no code and in this talk we're going to go through and implement research papers in 30 minutes.",In this talk the audience will learn how to take a research paper and quickly implement (within 30 minutes) and then how to actually evaluate if it's useful for their work or not.,,case study & advanced technical,5.0,Future trends,"Gen AI, Research papers, Implementation"," Aarushi is a passionate and seasoned AI engineer, currently working at AutoGPT - one of the most popular projects on GitHubm aiming to democratize AI. Previously she has initiated and lead Generative AI at Bumble as a principal engineer. She has also been a software engineer at iconic companies such as ThoughtWorks, Deliveroo and Tier Mobility.",https://www.youtube.com/watch?v=oUl6NEzHMDY,Information Technology Services,"It's unique because there's not real many frameworks, tools or guides out their on how to implement research papers and for most people in industry, theory alone is not enough. ",MLOps & GenAI World 2024,oUl6NEzHMDY
Ankit Pat,Genesys,Lead Machine Learning Applied Scientist,"Exploring the Frontier of Graph Neural Networks: Key Concepts, Architectures, and Trends","In today's data-driven world, the relationships and connections within data are as crucial as the data itself. Graph Neural Networks (GNNs) have emerged as a groundbreaking technology that leverages these relationships to uncover insights and drive innovation across various domains, from social network analysis to drug discovery. This talk, will delve into the fundamentals of GNNs, exploring their unique ability and versatility to model complex data structures through graph representations. We will discuss the core principles, architectures, and applications of GNNs, providing a comprehensive overview of how they can transform your approach to data analysis and problem-solving. Whether you're a data scientist, researcher, or industry professional, this talk will equip you with the knowledge to harness the full potential of GNNs in your work.","- Basics of Graph Structures and Graph Theory
- Fundamental Concepts, Key Components, and Architecture of GNNs
- Real-World Applications of GNNs Across Various Domains
- Advanced GNN Techniques: Including Graph Convolutional Networks (GCNs), Graph Attention Networks (GATs), and more.
- Emerging Trends and Future Directions in Graph Neural Networks",,Research or Advanced Technical,5.0,"Model dev, training, arch.","Graph Neural Networks, Key Concepts, Architectures
","Ankit Pat is a Lead Machine Learning Applied Scientist at Genesys, specializing in leading and contributing to applied Machine Learning research with a strong emphasis on product-centric approaches. He has over 9 years of industry experience and 4 years of academic research in Machine Learning (ML) and Artificial Intelligence (AI). He holds a Master's degree in Computer Science, specializing in AI, from the University of Waterloo, and both a Bachelor's and Master's in Mathematics and Computing from the Indian Institute of Technology, Kharagpur.

Ankit has authored over 10 patents and published 4 research papers at leading international conferences, including AAAI.",https://www.youtube.com/watch?v=ieY2dpQJA0U,"Computer Software, Information Technology & Service, Other
",,TMLS 2024,ieY2dpQJA0U
Michael Havey,Amazon Web Services,Senior Solutions Architect,Ask the Graph: How Knowledge Graphs Helps Generative AI Models Answer Questions," Generative AI has taken the world by storm. The Retrieval Augmented Generation (RAG) pattern has emerged as an effective way to incorporate your organization's data to provide current, accurate answers to questions that users ask a Large Language Model (LLM) Knowledge Graphs make RAG even more accurate and helpful. The secret sauce: relationships! I describe what a Knowledge Graph is, why it has long been a great database to answer questions, and how it can help an LLM using a pattern called Graph RAG. I present examples of Graph RAG in action from industries such as finance and healthcare."," You will learn how a Large Language Model (LLM) benefits from Retrieval Augmented Generation (RAG) to provide current, accurate answers to user questions grounded in your organization's data. A graph database helps make RAG more accurate because it maintains relationships between business objects. You will learn what a Knowledge Graph is and how to build Graph RAG on a Knowledge Graph. As a takeway, you will see the business benefit of Graph RAG, the value of more accurate, helpful answers!",,Applied Case Studies,3.0,Deployment and integration,"Knowledge Graphs, Retrieval Augmented Generation (RAG), Generative AI",Mike Havey is a Senior Solutions Architect for AWS with over 25 years of experience building enterprise applications. Mike is the author of two books and numerous articles.,https://www.youtube.com/watch?v=cdqIHS29HLA,"Automotive, Banking & Financial Services, Computer Software, Environmental Services, Food & Beverages, Hospital & Health Care, Information Technology & Service, Insurance, Marketing & Advertising, Telecommunications
",,TMLS 2024,cdqIHS29HLA
