Vinay Kumar Sankarapu,Arya.ai,Founder and CEO,DL-Backtrace by AryaXAI: A Model Agnostic Explainability for Any Deep Learning Models (LLMs to CV)," In today's rapidly evolving AI landscape, deep learning models have become increasingly complex and opaque. They often function as ""black boxes"" that make decisions without transparent reasoning. This lack of explainability raises concerns in mission-critical applications where understanding the ""why"" behind a model's decision is as important as the decision itself.

In this talk, we will introduce DL-Backtrace, a new technique designed at AryaXAI to explain any deep learning model—an LLM, traditional computer vision model, or beyond. We will discuss the algorithm and benchmarking results of DL-Backtrace against techniques like SHAPE, LIME, GradCAM, etc., for various DL models like LLMs (Llama 3.2), NLP (Bert), CV (ResNet), and tabular data.",The importance of explainability in mission-critical functions and model pruning; The current scope of explainability for deep learning models; complexities in scaling explainability for large models like LLMs; drawbacks with various current techniques; background about DL-Backrace; Results of the method for various DL models and subsequent work.,,Advanced Technical/Research,4.0,"Ethics, governance compliance ","Explainability, DL-Backtrace, Model transparency","Vinay Kumar Sankarapu is the Founder and CEO of Arya.ai. He did his Bachelor's and Master's in Mechanical Engineering at IIT Bombay with research in Deep Learning and published his thesis on CNNs in manufacturing. He started Arya.ai in 2013, one of the first deep learning startups, along with Deekshith, while finishing his Master's at IIT Bombay.

He co-authored a patent for designing a new explainability technique for deep learning and implementing it in underwriting in FSIs. He also authored a paper on AI technical debt in FSIs. He wrote multiple guest articles on ‘Responsible AI’, ‘AI usage risks in FSIs’. He presented multiple technical and industry presentations globally - Nvidia GTC (SF & Mumbai), ReWork (SF & London), Cypher (Bangalore), Nasscom(Bangalore), TEDx (Mumbai) etc. He was the youngest member of ‘AI task force’ set up by the Indian Commerce and Ministry in 2017 to provide inputs on policy and to support AI adoption as part of Industry 4.0. He was listed in Forbes Asia 30-Under-30 under the technology section.",https://www.youtube.com/watch?v=3ayUy9W6KvM,"Banking & Financial Services, Insurance, Information Technology Services, Hospital & Health Care",We will present the research paper we will release in November on DL-Backtrace.,MLOps & GenAI World 2024,3ayUy9W6KvM
Shelby Heinecke,Salesforce,Senior AI Research Manager,A Practical Guide to Efficient AI," In the past two years, we’ve witnessed a whirlwind of AI breakthroughs powered by extremely large and resource-demanding models. And as engineers and practitioners, we are now faced with deploying these AI models at scale in resource constrained environments, from cloud to on-device. In this talk, we will first identify key sources of inefficiency in AI models. Then, we will discuss techniques and practical tools to improve efficiency, from model architecture selection, to quantization, to prompt optimization.",,,case study & advanced technical,3.0,Performance optimization and efficiency,"Efficiency, Model optimization, Quantization"," Dr. Shelby Heinecke leads an AI research team at Salesforce. Shelby’s team develops cutting-edge AI for product and research in emerging directions including autonomous agents, LLMs, and on-device AI. Prior to leading her team, Shelby was a Senior AI Research Scientist focusing on robust recommendation systems and productionizing AI models. Shelby earned her Ph.D. in Mathematics from University of Illinois at Chicago, specializing in machine learning theory. She also holds an M.S. in Mathematics from Northwestern and a B.S. in Mathematics from MIT. Website: www.shelbyh.ai",https://www.youtube.com/watch?v=3HS0Cz_WFHM,"Computer Software, Information Technology Services",,MLOps & GenAI World 2024,3HS0Cz_WFHM
Joseph Tenini,Universal Music Group,Principal Data Scientist,Building Trust in ML Systems,"As builders of ML systems, much time and effort is spent in building our own trust with the technology we are developing. This can take the form of model accuracy metrics, compute efficiency, and core functionality achieved. There is another, often more daunting, step to be considered: building trust in the technology with non-technical users and other stakeholders who will be impacted by its adoption.
In this talk, we explore four pillars of building trust in ML systems with non-technical stakeholders:
Describing performance relative to an interpretable and intuitive baseline.
Quantifying uncertainty as part of the delivery process.
Sharing ""the why"" in non-binary decision processes.
Designing for 2nd order process effects.
After this talk, machine learning practitioners and managers will be equipped to build trust in the products they develop—enabling maximum value and impact from their work.",,,case study & advanced technical,3.0,Business and stakeholder alignment,"Trust in ML systems, Stakeholder alignment, Uncertainty quantification","Joseph Tenini has worked in data science for over a decade in a variety of industries including healthcare, publishing, digital marketing, and entertainment. He has developed, deployed, and managed the lifecycle of a variety of ML-enabled products in many different settings. His specific expertise lies in recommender systems, reinforcement learning, and process improvement. He holds a PhD in Mathematics from the University of Georgia.",https://www.youtube.com/watch?v=hLplCy-ufgw,"Hospital & Health Care, Marketing & Advertising",,MLOps & GenAI World 2024,hLplCy-ufgw
Shreya  Rajpal,Guardrails AI,Founder,Your AI applications need Guardrails: Here's how to build them,"Large Language Models (LLMs) such as ChatGPT have revolutionized AI applications, offering unprecedented potential for complex real-world scenarios. However, fully harnessing this potential comes with unique challenges such as model brittleness and the need for consistent, accurate outputs. These hurdles become more pronounced when developing production-grade applications that utilize LLMs as a software abstraction layer.

In this talk, we will tackle these challenges head-on. We introduce Guardrails AI, an open-source platform designed to mitigate risks and enhance the safety and efficiency of LLMs. We will delve into specific techniques and advanced control mechanisms that enable developers to optimize model performance effectively. Furthermore, we will explore how implementing these safeguards can significantly improve the development process of LLMs, ultimately leading to safer, more reliable, and robust real-world AI applications.","The audience will learn about the challenges and risks associated with Large Language Models (LLMs) and how the open-source platform, Guardrails AI, addresses these issues by providing specific techniques and advanced control mechanisms to optimize model performance, leading to safer, more reliable, and robust real-world AI applications.",,Advanced Technical/Research,4.0,Security and Privacy,"LLM challenges, Guardrails AI, Model safety and optimization
","Shreya Rajpal is the creator and maintainer of Guardrails AI, an open source platform developed to ensure increased safety, reliability, and robustness of large language models in real-world applications. Her expertise spans a decade in the field of machine learning and AI. Most recently, she was the founding engineer at Predibase, where she led the ML infrastructure team. In earlier roles, she was part of the cross-functional ML team within Apple's Special Projects Group and developed computer vision models for autonomous driving perception systems at Drive.ai.",https://www.youtube.com/watch?v=fdUY6_7ZX8M,"Banking & Financial Services, Hospital & Health Care, Information Technology & Service, Insurance, Telecommunications
",This talk will cover implementing end-to-end guardrails and safety interventions for Large Language Models (LLMs). These measures will promote a comprehensive approach to evaluating safety-first LLM development.,,fdUY6_7ZX8M
Zunair Waseem,Nebuly AI,Founding GTM,How to Build your Own LLM User Feedback Loop with Nebuly.,"User feedback is key to turning any good product into a great one, and LLM-powered products are no exception. However, less than 1% of LLM users provide explicit feedback (thumbs up/down), making it difficult to improve LLM responses and enhance the user experience. Learn how Nebuly helps companies with LLMs in production to build their own LLM User Feedback Loop.",,,Furture of AI,,Introduction to MLOps and GenAI,"LLM user feedback, Nebuly, Product improvement","Zunair Waseem is a graduate of the University of North Texas with a background in information systems. He originally began his career in the non-profit sector, doing humanitarian work overseas. After being in the space for nearly half a decade, Zunair became part of the founding team at Nebuly. He enjoys spending time outdoors, reading, being with family, and is committed to continuous learning. He also speaks three languages.",https://www.youtube.com/watch?v=OHJtZg9Owns,,,MLOps & GenAI World 2024,OHJtZg9Owns
Mahdi Torabi Rad,MLBoost,President,Uncertainty Quantification with Conformal Prediction: A Path to Reliable ML Models,"In today's high-stakes applications ranging from medical diagnostics to industrial AI, understanding and quantifying uncertainty in machine learning models is paramount to prevent critical failures. Conformal prediction, also known as conformal inference, offers a practical and robust approach to create statistically sound uncertainty intervals for model predictions. What sets conformal prediction apart is its distribution-free validity, providing explicit guarantees without relying on specific data distributions or model assumptions.

This hands-on workshop reviews the core concepts of conformal prediction, demonstrating its applicability across diverse domains such as computer vision, natural language processing, and deep reinforcement learning. Participants will gain a deep understanding of how to leverage conformal prediction with pre-trained models like neural networks to generate reliable uncertainty sets with customizable confidence levels.

Throughout the workshop, we'll explore practical theories, real-world examples, and Python code samples, including Jupyter notebooks for easy implementation on real data. From handling structured outputs and distribution shifts to addressing outliers and models that abstain, this workshop equips attendees with the tools to navigate complex machine learning challenges while ensuring model reliability and trustworthiness."," - What sets conformal prediction apart from other methods of uncertainty quantification?
- The principles and theory behind conformal prediction for uncertainty quantification in machine learning
- Techniques for creating statistically rigorous uncertainty sets/intervals using conformal prediction
- How to apply conformal prediction to pre-trained machine learning models, such as neural networks, for reliable uncertainty quantification
- Hands-on experience with implementing conformal prediction in Python using libraries like scikit-learn and NumPy
- Examples showcasing the application of conformal prediction in diverse domains such as financial forecasting, natural language processing (NLP), and computer vision","Basic understanding of machine learning concepts, including model training and evaluation. 
Familiarity with Python programming and libraries such as NumPy, Pandas, and scikit-learn",Workshop,4.0,Performance optimization and efficiency,"Conformal prediction, uncertainty quantification, machine learning models.
","Mahdi Torabi Rad, Ph.D. is a computational scientist, engineer, self-trained software developer, mentor, and YouTube content creator with over 10 years of experience in developing mathematical, statistical, and machine-learning models, as well as computer codes to predict complex phenomena. He has published in top-tier journals of Physics, Engineering, and ML and has extensive experience as an ML Lead in various DeepTech startups. Mahdi is also the YouTuber behind the channel MLBoost, known for its popular videos on ML topics, including Conformal Prediction, which have garnered tens of thousands of views in less than a year.",https://www.youtube.com/watch?v=7aXiQjBE_ak,"Banking & Financial Services, Information Technology & Service, Insurance, Computer Software
",,TMLS 2024,7aXiQjBE_ak
Mark Gibbas,Weather Source,CEO,Expert Insight - The Value of Solving Business Weather Challenges,"Weather impacts a wide range of business functions, this talk explores examples of these impacts and how to solve them.",,,Ignite Lighting Talk,,Business and stakeholder alignment,"Weather, Business, Impacts","
Mark has grown Weather Source from a small start-up to a leading provider of weather and climate technology. In its early years, Weather Source primarily provided weather information and consulting. During this time, Mark developed a vision for a scalable weather operating system that could serve clients across any industry and provide each with information relevant to their specific needs and locations of interest. Today, Weather Source’s OnPoint Platform and related products provide actionable weather insights to a growing list of top-ranked companies.
Prior to founding Weather Source, Mark applied his expertise in meteorology and computer science at Applied Insurance Research (AIR) and TASC. Among his notable accomplishments is the development of long-range forecasting systems that laid the foundation for the use of such technology at WSI and The Weather Company. Mark has also enjoyed working on projects for the United Nations’ World Meteorological Organization, where he advanced the meteorological capabilities of several Latin American countries. Mark holds a bachelor’s degree in meteorology with minors in computer science and mathematics.
",https://www.youtube.com/watch?v=q0x-n9FbZzQ,,,TMLS 2023,q0x-n9FbZzQ
Genesis Stefan,Genesis Cloud,Director of Product Management at Genesis Cloud,MemeGPT: Creating a Large Language Model to Generate Memes,"We built a Large Language Model to generate memes. We show you how, by using an open-source model as the foundation, you can construct your own Large Language Model and maintain complete control over your data and AI application",,,Ignite Lightning Talk,,"Model dev, training, arch.","Large Language Model, Meme Generation, Open-Source Model","Stefan Ojanen is Director of Product Management at Genesis Cloud, an accelerator cloud start-up focused on providing infrastructure for the AI space. Prior to joining Genesis Cloud, Stefan managed two data science teams at Scorable, Berlin based AI start-up that developed a holistic XAI-solution for asset managers. Stefan is a founding member of the MLOps community in Munich and also works as a freelance consultant on various AI projects.",https://www.youtube.com/watch?v=GWcjyf1asD0,,,MLOps & GenAI World 2023,GWcjyf1asD0
Jamie Dborin,TitanML,Co-Founder,How do you scale to billions of fine-tuned LLMs?,"Batched LORA Inference, a method gaining popularity that could be used to scale to billions of personalized, finetuned llms without paying the compute cost that this would naively imply. ",,,Ignite Lightning Talk,,Performance optimization and efficiency,"Batched LORA Inference, Scaling LLMs, Compute Efficiency","Jamie Dborin is a co-founder of TitanML, and works at TitanML building inference infrastructure for LLMs. ",https://www.youtube.com/watch?v=JGzas8cfrtw,,,MLOps & GenAI World 2023,JGzas8cfrtw
Vatsal Patel,MongoDB,Senior Data Scientist,A Data Scientist Guide to Unit & End to End Testing,"A comprehensive guide designed to equip data scientists with essential knowledge and practical skills for testing their developed and deployed models.

Key Topics Covered:
- Why Testing is Crucial in ML: Understand the importance of testing in the machine learning lifecycle and how it ensures model reliability and performance.

- Test-Driven Development: Learn about the TDD methodology, its benefits, and how it encourages writing clean, maintainable code by defining tests before implementing the functionality.

- Tools for Testing ML Models: Explore the tools available for unit testing, end-to-end testing, and CI/CD integration, such as `unittest`, `pytest`, `drone`, `GitHub Actions` etc.

- Unit Testing:
- Basic understanding of what unit testing is and its importance in verifying individual components of the ML pipeline.
- Best Practices: Identify best practices on how to approach testing, write test cases, and implement tests using popular frameworks.
- Tutorial: Practical examples illustrating how to write and run unit tests for data preprocessing functions and modelling.
- Running Tests: Instructions on running unit tests locally using `pytest`.

- End-to-End (E2E) Testing:
- Basic understanding of end-to-end testing, which validates the entire ML workflow from data ingestion to model serving.
Dependency Injection: Understand dependency injection and how it helps isolate components and create flexible test configurations.
- Best Practices: Best practices on defining workflows, writing test cases for critical paths, and implementing tests using E2E frameworks.
- Tutorial: Example of writing end-to-end tests for a scoring/training pipeline.
- Running Tests: Guidance on executing E2E tests locally using `pytest`.

Integration to CI/CD Pipelines: Learn how to automate model testing and deployment by integrating unit and end-to-end tests into CI/CD pipelines, ensuring continuous validation of code changes. This part will leverage Makefile & go over code coverage.

This presentation is ideal for data scientists, machine learning engineers, and anyone developing and deploying ML models who want to enhance their testing practices. By the end of the session, attendees will have a solid understanding of unit and end-to-end testing principles, practical examples to follow, and the confidence to implement these testing strategies in their projects.",,,Workshop,4.0,Performance optimization and efficiency,"Unit testing, End-to-end testing, CI/CD pipelines","Vatsal Patel, Senior Data Scientist, MongoDB",https://www.youtube.com/watch?v=6iKu2_suYrE,"Automotive, Banking & Financial Services, Computer Software, Enviromental Services, Hospital & Health Care, Food & Beverage, Information Technology Services, Insurance, Marketing & Advertising, Telecommunications, Other",,MLOps & GenAI World 2024,6iKu2_suYrE
Nima Safaei,Scotiabank,Sr. Data Scientist,Explainable Machine Learning in Finance – What If Machines Beat the Human Intelligence?,"Explainability is a necessity when applying AI/ML models for high-risk applications in the presence of many exogenous factors, latent variables, and disturbance processes. The good examples are financial, and econometric applications where, regardless of the model performance, the explainability of the outcomes is crucial for storytelling – extracting value from the AI/ML model in terms of some financial metrics and communicating them effectively across the company and with stakeholders. 
In complex environments with many exogenous factors, multiple causes and effects are interacting in complex ways through mechanisms that are often only partially understood. When some variables are latent (unobserved), the causal structure imply a complicated set of constraints on the distribution of observed variables.
Explainability in ML is two folded, Casual Explainability (also known as interpretability) and Counterfactual Explainability. While the former addresses ‘why’, the latter addresses ‘how’ small and plausible perturbations of the input variables modify the output?  For financial storytelling, the former is much more important than the latter because the reasoning through a causal chain brings more confidence on outcomes. A higher confidence can be translated as a lower (market/capital/operational) risk of the false alarms. 
One major challenge in high-risk applications with complex environments is that the explanations provided by machine should be verified by a subject matter expert (SME), otherwise, the outcomes cannot be trusted for further decision making. The question is when we realize that the machine may beat the human by leveraging the information beyond the SME’s knowledge? Should we expect the machine to leverage a level of intelligence which we cannot handle it? In this talk, I try to discuss and answer the above questions through a causal inference lens.",Explainability in Financial Applications thru. Causal Inference,,Advanced Technical,5.0,"Ethics, governance compliance ","Explainability, Financial Applications, Causal Inference","Oral talk/presentation in various word-calss AI/ML conferences such as TMLS 2021/2022, CORS/Informs, ICML 2021, NVIDIA GTC 2020/2021",https://www.youtube.com/watch?v=K66__Z3LZCw,"Banking & Financial Services, Hospital & Health Care, Information Technology & Service, High-risk areas such as Aerospace & Aviation 
","One major challenge in high-risk applications with complex environments is that the explanations provided by the machine should be verified by a subject matter expert (SME), otherwise, the outcomes cannot be trusted for further decision making. The question is when we realize that the machine may beat the human by leveraging the information beyond the SME’s knowledge? Should we expect the machine to leverage a level of intelligence which we cannot handle it?
",TMLS 2023,K66__Z3LZCw
Jesse Cresswell,Layer 6 AI,Sr. Machine Learning Scientist,Quantifying the uncertainty in model predictions,"Neural networks are infamous for making wrong predictions with high confidence. Ideally, when a model encounters difficult inputs, or inputs unlike data it saw during training, it should signal to the user that it is unconfident about the prediction. Better yet, the model could offer alternative predictions when it is unsure about its best guess. Conformal prediction is a general purpose method for quantifying the uncertainty in a model's predictions, and generating alternative outputs. It is versatile, not requiring assumptions on the model and being applicable to classification and regression alike. It is statistically rigorous, providing a mathematical guarantee on model confidence. And, it is simple, involving an easy three-step procedure that can be implemented in 3-5 lines of code. In this talk I will introduce conformal prediction and the intuition behind it, along with examples of how it can be applied in real-world usecases.",Conformal prediction is a mathematical/statistical procedure which may be difficult to understand for less technical audience members. In my talk I will cut through the mathematics to provide the intuition of conformal prediction using visual aids and real-world examples. The audience will take away several settings where they ca immediately apply the technique.,,Advanced Technical / Research,6.0,Performance optimization and efficiency,"Uncertainty in Model Predictions, Conformal Prediction, Neural Networks





",Spoke at TMLS 2022 about Privacy and Fairness. I lead a team of ML scientists at TD's research lab. My team focuses on Trustworthy AI.,https://www.youtube.com/watch?v=-K8vDIyT3xY,"Banking & Financial Services, Computer Software, Hospital & Health Care, Insurance, Marketing & Advertising
","This topic has not been seen before at TMLS. I will not shy away from the mathematical understanding, since that is a main benefit of the approach, but my focus will be on providing the intuition first, visually. As a lead scientist at Layer 6 AI @ TD, I have personally used conformal prediction in real-world financial modelling applications and can provide the audience guidance on the best practices.
",TMLS 2023,-K8vDIyT3xY
"Raheleh Givehchi, Hicham Benzamane",Pelmorex Corp. (The Weather Network),"Lead Data Scientist, Team Lead, Data Engineering Insights",Challenges and Learnings of Machine Learning at scale,How to train millions of models while keeping cost very low and predict on daily basis with the highest performance.,"- Real world Data optimization techniques for training and prediction
- Scale techniques using Cloud infrastructure","- basics on Machine Learning
- basics on Cloud Computing ",Workshop,5.0,"Model dev, training, arch.","Machine Learning at Scale, Data Optimization Techniques, Cloud Infrastructure","Raheleh Givehchi - Lead Data Scientist
I am a lead data scientist with several  years of experience in data science and machine learning. I specialize in delivering valuable insights through data analytics and advanced data-driven methods. Currently, I am working on the Weather Insight Platform (WIP) to provide data-driven solutions to weather-related challenges.

Hicham Benzamane - Team Lead, Data Engineering Insights
- Multiple years working experience in software development and Data engineering.
- Now leading a team of software and data engineers to leverage data and ML to empower Pelmorex customers with cutting edge insights.",https://www.youtube.com/watch?v=QDoH3HLcPhY,,,TMLS 2023,QDoH3HLcPhY
